{
  "$schema": "https://json-schema.org/draft/2020-12/schema",
  "$id": "https://docprocessor.example.com/contracts/document-uploaded.schema.json",
  "title": "DocumentUploadedEvent",
  "description": "document.uploaded: published by the document service on the document-events topic and forwarded to the extraction-jobs queue, where the worker reads it as its job. message_id is doc_id. Either blob_name or blob_url must be non-empty.",
  "type": "object",
  "properties": {
    "event_type": {
      "description": "Absent on messages queued by upload-service 1.x.",
      "const": "document.uploaded",
      "default": "document.uploaded"
    },
    "doc_id": { "type": "string", "minLength": 1 },
    "tenant_id": { "type": "string", "minLength": 1 },
    "content_type": { "type": "string", "minLength": 1 },
    "filename": { "type": ["string", "null"], "default": null },
    "size_bytes": { "type": ["integer", "null"], "default": null },
    "blob_name": {
      "description": "Preferred source location, within blob_container. Older messages carry only blob_url.",
      "type": ["string", "null"],
      "default": null
    },
    "blob_url": { "type": ["string", "null"], "default": null },
    "blob_container": { "type": ["string", "null"], "default": null },
    "correlation_id": { "type": ["string", "null"], "default": null },
    "submitted_at": { "type": ["string", "null"], "format": "date-time", "default": null }
  },
  "required": ["doc_id", "tenant_id", "content_type"],
  "not": {
    "description": "Neither blob_name nor blob_url is set.",
    "properties": {
      "blob_name": { "enum": [null, ""] },
      "blob_url": { "enum": [null, ""] }
    }
  }
}
