{
  "event_type": "document.uploaded",
  "doc_id": "6f1c2a9e-8f3b-4c1d-9e2a-0b7d5c3e1f40",
  "tenant_id": "11111111-1111-1111-1111-111111111111",
  "filename": "Отчёт 2024.pdf",
  "content_type": "application/pdf",
  "size_bytes": 766926,
  "blob_name": "11111111-1111-1111-1111-111111111111/6f1c2a9e-8f3b-4c1d-9e2a-0b7d5c3e1f40/Отчёт 2024.pdf",
  "blob_url": "https://acct.blob.core.windows.net/raw-documents/11111111-1111-1111-1111-111111111111/6f1c2a9e-8f3b-4c1d-9e2a-0b7d5c3e1f40/%D0%9E%D1%82%D1%87%D1%91%D1%82%202024.pdf",
  "blob_container": "raw-documents",
  "correlation_id": "corr-1",
  "submitted_at": "2026-01-01T00:00:00.000Z"
}
